,Title,URL,IssueType,Labels
1172,Cannot use sliced tests(JooqTest) with caching,https://github.com/spring-projects/spring-boot/issues/17065,Bug,0
1173,Configuration Processor should use the constructor as a source only with @ConstructorBinding,https://github.com/spring-projects/spring-boot/issues/17035,Bug,0
1174,SpringIterableConfigurationPropertySource cache is not thread safe,https://github.com/spring-projects/spring-boot/issues/17018,Bug,0
1175,Handle all getters first in JavaBeanBinder.addProperties(),https://github.com/spring-projects/spring-boot/issues/17016,Bug,0
1176,RestTemplateBuilder.basicAuth causes the entire body to be read into memory,https://github.com/spring-projects/spring-boot/pull/17010,Bug,0
1177,server.port should not be set to -1 if the test does not start an embedded web server,https://github.com/spring-projects/spring-boot/issues/16998,Bug,0
1178,JVM can't exit due to threads left if Tomcat throws exceptions during shutdown,https://github.com/spring-projects/spring-boot/issues/16995,Bug,0
1179,Spring Session without Spring Security leads to NoClassDefFoundError: org/springframework/security/web/authentication/RememberMeServices,https://github.com/spring-projects/spring-boot/issues/16992,Bug,0
1180,Spring Data Cassandra auto-configuration should be conditional on Cluster bean,https://github.com/spring-projects/spring-boot/issues/16990,Bug,0
1181,JavaBeanBinder.Bean.get() does not use updated resolved type when checking for type differences,https://github.com/spring-projects/spring-boot/issues/16988,Bug,0
1182,Wrong reference to org.apache.catalina.core.ApplicationContext in ServletWebServerFactory,https://github.com/spring-projects/spring-boot/issues/16978,Bug,0
1183,Pass resolvedType into isOfDifferentType() in JavaBeanBinder.Bean.get(),https://github.com/spring-projects/spring-boot/pull/16974,Bug,0
1184,spring-boot:run uses the wrong default working directory for a forked JVM,https://github.com/spring-projects/spring-boot/issues/16960,Bug,0
1185,WebSphere Liberty's WSJdbcDataSource logs an exception during startup when using a JNDI DataSource with Hikari still on the classpath,https://github.com/spring-projects/spring-boot/issues/16940,Bug,0
1186,ReactiveSecurityAutoConfiguration can cause TypeNotPresentExceptionProxy,https://github.com/spring-projects/spring-boot/issues/16939,Bug,0
1187,FileEditor not applied for String to File property conversion,https://github.com/spring-projects/spring-boot/issues/16931,Bug,0
1188,Constructor-based configuration property binding fails silently when parameter name information is not available,https://github.com/spring-projects/spring-boot/issues/16928,Bug,0
1189,spring-boot-dependencies manages jetty-infinispan which no longer exists,https://github.com/spring-projects/spring-boot/issues/16925,Bug,0
1190,"Application is still running with ""APPLICATION FAILED TO START"" message",https://github.com/spring-projects/spring-boot/issues/16902,Bug,0
1191,Fix NoClassDefFoundError when Spring Session is used without Spring Security,https://github.com/spring-projects/spring-boot/pull/16889,Bug,0
1192,RedisReactiveHealthIndicator makes blocking call on error,https://github.com/spring-projects/spring-boot/issues/16860,Bug,0
1193,Binder can fail when multiple overloaded setters exist,https://github.com/spring-projects/spring-boot/issues/16859,Bug,0
1194,HTTPS urls cause NPE when using Jetty Reactor,https://github.com/spring-projects/spring-boot/issues/16858,Bug,0
1195,Binder can fail with POJOs that have generic types,https://github.com/spring-projects/spring-boot/issues/16857,Bug,0
1196,ConfigurationPropertyName.equals can fail with dashed names,https://github.com/spring-projects/spring-boot/issues/16855,Bug,0
1197,"Maven plugin may repackage an archive twice, resulting in a StackOverflowError at runtime",https://github.com/spring-projects/spring-boot/issues/16828,Bug,0
1198,Cannot call HTTP when rsocket server is activated,https://github.com/spring-projects/spring-boot/issues/16826,Bug,0
1199,Redis pooling minIdle property is ignored as timeBetweenEvictionRun defaults to -1 and cannot be configured,https://github.com/spring-projects/spring-boot/issues/16809,Bug,0
1200,JUnit 4 is no longer on the compile classpath with Gradle,https://github.com/spring-projects/spring-boot/issues/16807,Bug,0
1201,Dependency management for Kafka is incomplete,https://github.com/spring-projects/spring-boot/issues/16746,Bug,0
1202,'spring.resources.cache.period' is always overridden by 'spring.resources.cache.cachecontrol',https://github.com/spring-projects/spring-boot/pull/16730,Bug,0
1203,"RedisReactiveHealthIndicator blocks on error by calling close, which is not supported in thread reactor-http-epoll",https://github.com/spring-projects/spring-boot/issues/16705,Bug,0
1204,AbstractErrorWebExceptionHandler fails when the response has a non-standard status code,https://github.com/spring-projects/spring-boot/issues/16691,Bug,0
1205,The -d option of spring init CLI command is not POSIX compliant,https://github.com/spring-projects/spring-boot/issues/16663,Bug,0
1206,JacksonTester handles some characters asymmetrically,https://github.com/spring-projects/spring-boot/issues/16649,Bug,0
1207,Metrics may be updated twice when CompositeMeterRegistry exists,https://github.com/spring-projects/spring-boot/issues/16644,Bug,0
1208,Exclude HikariCP specific dependency from Quartz,https://github.com/spring-projects/spring-boot/pull/16628,Bug,0
1209,Decoding of key from file specified by spring.security.oauth2.resourceserver.public-key-location fails on Windows,https://github.com/spring-projects/spring-boot/issues/16624,Bug,0
1210,Dependency management for Glassfish JAXB is incomplete,https://github.com/spring-projects/spring-boot/issues/16623,Bug,0
1211,UndertowWebServer's logger is wrong,https://github.com/spring-projects/spring-boot/pull/16613,Bug,0
1212,@ConfigurationPropertiesScan not compatible with @Profile @ConfigurationProperties,https://github.com/spring-projects/spring-boot/issues/16612,Bug,0
1213,EL-based validation message interpolation does not work when using spring-boot-starter-webflux,https://github.com/spring-projects/spring-boot/issues/16596,Bug,0
1214,Dependency management is provided for solr-uima which does not exist in 7.7,https://github.com/spring-projects/spring-boot/issues/16572,Bug,0
1215,ConfigurationMetadataProperty name not stripped with same source types,https://github.com/spring-projects/spring-boot/issues/16565,Bug,0
1216,"Actuator /configprops shows Duration properties as { ""units"": [ ""SECONDS"", ""NANOS"" ] }",https://github.com/spring-projects/spring-boot/pull/16539,Bug,0
1217,Exclude correct HikariCP version,https://github.com/spring-projects/spring-boot/issues/16489,Bug,0
1218,"When running on a separate port, Actuator health endpoint may report healthy before the main port is listening",https://github.com/spring-projects/spring-boot/issues/16473,Bug,0
1219,Liquibase endpoint does not honor custom change log table,https://github.com/spring-projects/spring-boot/issues/16461,Bug,0
1220,server.tomcat.processor-cache cannot be used to configure an unlimited processor cache,https://github.com/spring-projects/spring-boot/issues/16415,Bug,0
1221,ThymeleafAutoConfiguration fails if thymeleaf-spring5 is not present,https://github.com/spring-projects/spring-boot/pull/16341,Bug,0
1222,Null serialisation is not disabled when spring.gson.serialize-nulls is set to false,https://github.com/spring-projects/spring-boot/pull/16332,Bug,0
1223,Kafka Streams auto-configuration should only configure default streams builder,https://github.com/spring-projects/spring-boot/issues/16329,Bug,0
1224,Logfile endpoint cannot be disabled using the standard property,https://github.com/spring-projects/spring-boot/pull/16298,Bug,0
1225,Binding to collection fails with unbound elements error if collection overridden in another property source,https://github.com/spring-projects/spring-boot/issues/16290,Bug,0
1226,Missing jaxb-api dependency in spring-boot-starter-jersey,https://github.com/spring-projects/spring-boot/issues/16268,Bug,0
1227,Import ErrorWebFluxAutoConfiguration with @WebFluxTest,https://github.com/spring-projects/spring-boot/pull/16266,Bug,0
1228,When using Log4j2 log4j2.properties files are not detected,https://github.com/spring-projects/spring-boot/pull/16262,Bug,0
1229,spring-boot-actuator solr health indicator reports solr down when solr client baseUrl contains core,https://github.com/spring-projects/spring-boot/issues/16256,Bug,0
1230,Including finalName in plugin configuration results in StackOverflowError,https://github.com/spring-projects/spring-boot/issues/16202,Bug,0
1231,Clients with incompatible default encoding may corrupt output from log file endpoint as it does not specify the charset that it produces,https://github.com/spring-projects/spring-boot/issues/16189,Bug,0
1232,logfile endpoint returns HTTP 406 on Accept: text/plain,https://github.com/spring-projects/spring-boot/issues/16188,Bug,0
1233,Skip lazy initialization of beans that explicitly set the lazy attribute to false,https://github.com/spring-projects/spring-boot/issues/16184,Bug,0
1234,JsonTest isn't annotated with @ExtendWith(SpringExtension.class),https://github.com/spring-projects/spring-boot/issues/16183,Bug,0
1235,Dependency management for micrometer-registry-stackdriver is missing,https://github.com/spring-projects/spring-boot/pull/16178,Bug,0
1236,WebFlux or MVC app with the Validation API and no implementation fails to start,https://github.com/spring-projects/spring-boot/issues/16177,Bug,0
1237,@WebFluxTest does not enable auto-configuration for any reactive template engines,https://github.com/spring-projects/spring-boot/pull/16170,Bug,0
1238,When using WebFlux /actuator/health/{component} returns a 200 response when the component is down,https://github.com/spring-projects/spring-boot/issues/16109,Bug,0
1239,Random management.server.port should not set to the same value as local.server.port,https://github.com/spring-projects/spring-boot/pull/16108,Bug,0
1240,Random management.server.port gets set to the same value as local.server.port,https://github.com/spring-projects/spring-boot/issues/16102,Bug,0
1241,AbstractRefreshableApplicationContext should not appear in the type hierarchy of our application context implementations,https://github.com/spring-projects/spring-boot/issues/16096,Bug,0
1242,"When MongoReactiveAutoConfiguration creates a MongoClient that uses Netty, EventLoopGroup threads prevent the JVM from exiting",https://github.com/spring-projects/spring-boot/pull/16087,Bug,0
1243,Rename Maven version property for PooledJMS,https://github.com/spring-projects/spring-boot/pull/16086,Bug,0
1244,Auto-configured PrometheusPushGatewayManager cannot be configured to use HTTPS to connect to the gateway,https://github.com/spring-projects/spring-boot/pull/16084,Bug,0
1245,Permit use of @JsonTest without Jackson,https://github.com/spring-projects/spring-boot/pull/16070,Bug,0
1246,Gradle plugin does not write all required manifest entries,https://github.com/spring-projects/spring-boot/issues/16068,Bug,0
1247,Database migrations may not have run before NamedParameterJdbcTemplate is used,https://github.com/spring-projects/spring-boot/pull/16047,Bug,0
1248,Fix NullPointerException with empty X-Forwarded-For header,https://github.com/spring-projects/spring-boot/pull/16046,Bug,0
1249,NullPointerException with empty X-Forwarded-For header,https://github.com/spring-projects/spring-boot/issues/16044,Bug,0
1250,AprLifecycleListener is configured even though Tomcat's native library is not available,https://github.com/spring-projects/spring-boot/issues/16040,Bug,0
1251,Unexpected constructor-based initialization of @ConfigurationProperties leads to inconsistent behavior,https://github.com/spring-projects/spring-boot/issues/16038,Bug,0
1252,"When unzipping, spring init may write zip entries outside the specified output location",https://github.com/spring-projects/spring-boot/issues/16028,Bug,0
1253,"When spring.profiles.include is set in a property source with higher precedence than the config files, spring.profiles.include in the config files should be ignored",https://github.com/spring-projects/spring-boot/issues/16023,Bug,0
1254,Handle missing exceptions in WebMvcMetricsFilter,https://github.com/spring-projects/spring-boot/pull/16014,Bug,0
1255,Fat jar built with Maven does not repackage META-INF/<module-name>.kotlin_module files into BOOT-INF/classes,https://github.com/spring-projects/spring-boot/pull/16004,Bug,0
1256,Gradle POM-only dependencies cause jar application loader to fail,https://github.com/spring-projects/spring-boot/issues/16001,Bug,0
1257,Order TaskExecutionAutoConfiguration before TaskSchedulingAutoConfiguration,https://github.com/spring-projects/spring-boot/pull/15984,Bug,0
1258, Order TaskExecutionAutoConfiguration before TaskSchedulerAutoConfiguration,https://github.com/spring-projects/spring-boot/issues/15983,Bug,0
1259,Do not replace a request factory when creating a new `TestRestTemplate` with `withBasicAuth`,https://github.com/spring-projects/spring-boot/pull/15982,Bug,0
1260,Order TaskExecutionAutoConfiguration before TaskSchedulerAutoConfiguration,https://github.com/spring-projects/spring-boot/issues/15963,Bug,0
1261,Exclude dependencies during repackaging process for the war archive,https://github.com/spring-projects/spring-boot/pull/15947,Bug,0
1262,TestRestTemplateContextCustomizer and WebTestClientContextCustomizer can cause early FactoryBean instantiation,https://github.com/spring-projects/spring-boot/issues/15898,Bug,0
1263,ServletEndpoints should not register under the Jersey context path if there is a management port,https://github.com/spring-projects/spring-boot/issues/15891,Bug,0
1264,Fat jar built with Maven does not repackage META-INF/<module-name>.kotlin-module files into BOOT-INF/classes,https://github.com/spring-projects/spring-boot/issues/15890,Bug,0
1265,Auto-configured OpenEntityManagerInViewInterceptor does not back off when an OpenEntityManagerInViewFilter is only defined as a registration bean,https://github.com/spring-projects/spring-boot/pull/15889,Bug,0
1266,Jersey-based actuator endpoints not available without ResourceConfig bean,https://github.com/spring-projects/spring-boot/issues/15877,Bug,0
1267,Configuration processor does not handle generics,https://github.com/spring-projects/spring-boot/issues/15850,Bug,0
1268,Illegal reflective access by org.springframework.boot.loader.jar.Handler when resolving classpath* resource pattern,https://github.com/spring-projects/spring-boot/issues/15844,Bug,0
1269,ClassCastException in TestRestTemplateContextCustomizer,https://github.com/spring-projects/spring-boot/issues/15843,Bug,0
1270,Undertow connection timeout is set incorrectly,https://github.com/spring-projects/spring-boot/pull/15822,Bug,0
1271,java.lang.NullPointerException: null occurs in HttpExchangeTracer,https://github.com/spring-projects/spring-boot/issues/15819,Bug,0
1272,/actuator/scheduletasks endpoint fails with null pointer exception when there is custom SchedulingConfigurer,https://github.com/spring-projects/spring-boot/issues/15815,Bug,0
1273,Repackaging moves an existing module-info.class file into BOOT-INF/classes,https://github.com/spring-projects/spring-boot/issues/15810,Bug,0
1274,JspTemplateAvailabilityProvider causes java.security.AccessControlException,https://github.com/spring-projects/spring-boot/pull/15778,Bug,0
1275,Unhandled exceptions are not logged with WebFlux,https://github.com/spring-projects/spring-boot/issues/15769,Bug,0
1276,"When user switching is configured insecurely (allowing switching from an anonymous user), Actuator's `AuthenticationAuditListener` will NPE when exiting the switch",https://github.com/spring-projects/spring-boot/issues/15767,Bug,0
1277,DevTools incorrectly logs a change in condition evaluation when starting an application with multiple contexts,https://github.com/spring-projects/spring-boot/issues/15766,Bug,0
1278,Typos in unsupported type messages produced by JsonContentAssert,https://github.com/spring-projects/spring-boot/pull/15752,Bug,0
1279,Async configuration ignores `applicationTaskExecutor` when `EnableScheduling` is enabled ,https://github.com/spring-projects/spring-boot/pull/15748,Bug,0
1280,Async configuration ignores `applicationTaskExecutor` when `EnableScheduling` is enabled,https://github.com/spring-projects/spring-boot/issues/15729,Bug,0
1281,"Unlike Jetty and Tomcat, Reactor Netty and Undertow do not cause a startup failure when SSL is enabled but no key store is configured",https://github.com/spring-projects/spring-boot/pull/15709,Bug,0
1282,Embedded Mongo may be shut down while being used during application context close processing,https://github.com/spring-projects/spring-boot/pull/15692,Bug,0
1283,Application with spring.main.web-application-type=NONE doesn't shut down in conjunction with data mongodb reactive starter,https://github.com/spring-projects/spring-boot/issues/15675,Bug,0
1284,Align WebFluxTags#uri() with WebMvcTags#uri(),https://github.com/spring-projects/spring-boot/pull/15609,Bug,0
1285,@ConfigurationProperty validation not working when a key matching the prefix is set,https://github.com/spring-projects/spring-boot/issues/15597,Bug,0
1286,server.compression.enabled=true doesn't work when using ssl and http/2 ,https://github.com/spring-projects/spring-boot/issues/15591,Bug,0
1287,Documentation links in the README have not been updated following the move to pure Asciidoctor,https://github.com/spring-projects/spring-boot/issues/15545,Bug,0
1288,Reactive health indicator for Redis waits forever when the redis server is down,https://github.com/spring-projects/spring-boot/issues/15542,Bug,0
1289,"Binding to a Map with EnumSet values fails with ""Cannot create EnumSet for unknown element type""",https://github.com/spring-projects/spring-boot/issues/15539,Bug,0
1290,Task input and output annotations on BootJar and BootWar are incomplete,https://github.com/spring-projects/spring-boot/issues/15488,Bug,0
1291,MeterBinder that uses Health infrastructure causes Rabbit metrics to be bound before meter registry customization has completed,https://github.com/spring-projects/spring-boot/issues/15483,Bug,0
1292,Skip actuator security autoconfig if resource server autoconfig is active,https://github.com/spring-projects/spring-boot/pull/15472,Bug,0
1293,Dependency management for Groovy 2.5 is incomplete,https://github.com/spring-projects/spring-boot/issues/15468,Bug,0
1294,Hibernate's dependency management is missing an entry for hibernate-vibur,https://github.com/spring-projects/spring-boot/pull/15467,Bug,0
1295,Fix StringSequence.equals() for different lengths,https://github.com/spring-projects/spring-boot/pull/15465,Bug,0
1296,spring.profiles.active from defaultProperties takes precedence over config files,https://github.com/spring-projects/spring-boot/issues/15445,Bug,0
1297,TestRestTemplate.withBasicAuth resets custom requestFactory,https://github.com/spring-projects/spring-boot/issues/15443,Bug,0
1298,An application that uses Liquibase and spring-boot-starter-log4j2 fails to start due to Logback Classic being on the classpath,https://github.com/spring-projects/spring-boot/issues/15436,Bug,0
1299,Avoid NPE when replacement property does not exist,https://github.com/spring-projects/spring-boot/pull/15394,Bug,0
1300,Fix web session javadoc typo,https://github.com/spring-projects/spring-boot/issues/39954,Documentation,1
1301,Fix typo in Custom HTTP Exchange Recording section,https://github.com/spring-projects/spring-boot/issues/39785,Documentation,1
1302,Typo in Spring Boot Docs Section 10.1 Custom HTTP Exchange Recording,https://github.com/spring-projects/spring-boot/issues/39768,Documentation,1
1303,"Make description of virtual threads and JVM exit easier to understand by removing ""no-non"" double-negative",https://github.com/spring-projects/spring-boot/issues/39738,Documentation,1
1304,Add note regarding mixing of bundle-based and direct SSL configuration,https://github.com/spring-projects/spring-boot/issues/39642,Documentation,1
1305,Document that task executor pool size properties are ignored when using virtual threads,https://github.com/spring-projects/spring-boot/issues/39632,Documentation,1
1306,Add link to Pulsar workaround when using environment variables for authentication,https://github.com/spring-projects/spring-boot/issues/39631,Documentation,1
1307,Document default value for show-value configuration properties,https://github.com/spring-projects/spring-boot/issues/39597,Documentation,1
1308,Clarify that configuration properties only apply to the auto-configured OpenTelemetry Resource bean,https://github.com/spring-projects/spring-boot/issues/39517,Documentation,1
1309,Add Javadoc for ServerProperties.mimeMappings,https://github.com/spring-projects/spring-boot/pull/39503,Documentation,1
1310,Update the Debugging Documentation of the Spring Boot Maven Plugin ,https://github.com/spring-projects/spring-boot/issues/39423,Documentation,1
1311,Awaitility link in Test Scoped Dependencies is incorrect,https://github.com/spring-projects/spring-boot/issues/39417,Documentation,1
1312,Fixed NestedJarFile constructor javadoc,https://github.com/spring-projects/spring-boot/issues/39338,Documentation,1
1313,Using SSL Bundle for server configuration ignores other server options,https://github.com/spring-projects/spring-boot/issues/39310,Documentation,1
1314,Endpoint documentation contains the typo 'Unuthorized',https://github.com/spring-projects/spring-boot/issues/39281,Documentation,1
1315,Update Revved up by Develocity badge,https://github.com/spring-projects/spring-boot/issues/39264,Documentation,1
1316,"Improve ""Sanitize Sensitive Values"" section in reference documentation",https://github.com/spring-projects/spring-boot/issues/39200,Documentation,1
1317,Update CRaC support status link,https://github.com/spring-projects/spring-boot/issues/39173,Documentation,1
1318,Fix link to Log4j2's JDK logging adapter documentation,https://github.com/spring-projects/spring-boot/issues/39172,Documentation,1
1319,Document virtual threads limitations,https://github.com/spring-projects/spring-boot/issues/39169,Documentation,1
1320,Remove entry for OCI starter as it is no longer maintained,https://github.com/spring-projects/spring-boot/issues/39165,Documentation,1
1321,Polish reference documentation,https://github.com/spring-projects/spring-boot/issues/39157,Documentation,1
1322,"Use the term ""tags"" in documentation consistently",https://github.com/spring-projects/spring-boot/issues/39152,Documentation,1
1323,Update links to Micrometer docs in metrics section of reference docs,https://github.com/spring-projects/spring-boot/issues/39150,Documentation,1
1324,Correct the documentation on injecting dependencies into FailureAnalyzer implementations,https://github.com/spring-projects/spring-boot/issues/39101,Documentation,1
1325,Fix typos,https://github.com/spring-projects/spring-boot/pull/38983,Documentation,1
1326,Fix typo,https://github.com/spring-projects/spring-boot/issues/38879,Documentation,1
1327,Add the LangChain4J Spring Boot Starter to the list of community starters,https://github.com/spring-projects/spring-boot/pull/38776,Documentation,1
1328,Document prerequisites for Docker Compose support,https://github.com/spring-projects/spring-boot/issues/38764,Documentation,1
1329,Update Dynatrace documentation links,https://github.com/spring-projects/spring-boot/issues/38725,Documentation,1
1330,Correct references to Jetty's HTTP2 server module,https://github.com/spring-projects/spring-boot/pull/38632,Documentation,1
1331,Fix Observation Filter docs,https://github.com/spring-projects/spring-boot/issues/38586,Documentation,1
1332,Reinstate mention of testAndDevelopmentOnly when using Testcontainers at dev time,https://github.com/spring-projects/spring-boot/issues/38571,Documentation,1
1333,Document supported SQL comment prefixes,https://github.com/spring-projects/spring-boot/issues/38496,Documentation,1
1334,Update access log pattern documentation to align with changes in Tomcat 10,https://github.com/spring-projects/spring-boot/issues/38425,Documentation,1
1335,Update Dynatrace docs with info about the meter metadata toggle,https://github.com/spring-projects/spring-boot/pull/38368,Documentation,1
1336,Improve documentation regarding tracing in tests,https://github.com/spring-projects/spring-boot/issues/38362,Documentation,1
1337,Document the accepted inputs when configuring tags on spring-boot:build-image and bootBuildImage,https://github.com/spring-projects/spring-boot/issues/38354,Documentation,1
1338,Document how to use cloudfoundry specific actuators with a custom base path for webflux applications,https://github.com/spring-projects/spring-boot/issues/38353,Documentation,1
1339,Document Liberica JDK with CRaC,https://github.com/spring-projects/spring-boot/pull/38350,Documentation,1
1340,Add a Restarting a stopped or failed Job section to the batch howto,https://github.com/spring-projects/spring-boot/issues/38341,Documentation,1
1341,Clarify documentation on importing Testcontainer declarations and using @ServiceConnection or @DynamicPropertySource,https://github.com/spring-projects/spring-boot/issues/38337,Documentation,1
1342,Make distinction between Testcontainers for integration tests and development more clear in documentation,https://github.com/spring-projects/spring-boot/issues/38336,Documentation,1
1343,"When using Testcontainers at development time with @ServiceConnection on a @Bean method, describe when to use the name attribute and why",https://github.com/spring-projects/spring-boot/issues/38335,Documentation,1
1344,Fix link to Elasticsearch health indicator,https://github.com/spring-projects/spring-boot/issues/38334,Documentation,1
1345,Update Spring Framework documentation links,https://github.com/spring-projects/spring-boot/issues/38289,Documentation,1
